{
  "id": "windows/ultra-treesize-ninja",
  "name": "Ultra TreeSize Ninja",
  "version": "1.0.1",
  "description": "PowerShell automation that deploys the Ultra TreeSize Ninja script for storage usage auditing.",
  "platform": "windows",
  "tags": [
    "powershell",
    "storage"
  ],
  "requiresBackup": false,
  "customFields": [
    {
      "type": "device",
      "path": "custom-fields/treesize.json"
    }
  ],
  "assets": {
    "script": {
      "path": "script.json",
      "checksum": "4f65ee6b8cc94287aff190d2892b1dc5eb279faea17495b66699359b9a0d4577"
    },
    "customFields": [
      {
        "path": "custom-fields/treesize.json",
        "checksum": "9e722a0b480476be8ce20b368d7a7d7871bc1a9f8d0bdd0327c57a3c75c3c121"
      }
    ]
  }
}
